{
  "question_id": 37,
  "canonical_text": "a shopkeeper bought oranges at the rate of 7 for a rupee and sold them at a profit of 40. how many oranges would he sell for a rupee||4|5|6|7",
  "option_a": "4",
  "option_b": "5",
  "option_c": "6",
  "option_d": "7",
  "option_e": "",
  "correct_answer": "5",
  "answer_letter": "B",
  "version": 1
}