{
  "question_id": 77,
  "canonical_text": "a seller sold 2kgs of oranges for rs.156.25 at a loss of 20. at what price must he sell 2kgs of oranges to gain 25||rs.136.25|rs.156.25|rs.159.25|rs.200",
  "option_a": "Rs.156.25",
  "option_b": "Rs.200",
  "option_c": "Rs.159.25",
  "option_d": "Rs.136.25",
  "option_e": "",
  "correct_answer": "Rs.200",
  "answer_letter": "B",
  "version": 1
}