{
  "question_id": 36,
  "canonical_text": "manish sells 60 of goods at 20 loss while he sells the rest at 25 profit. if there is a total loss of rs. 100 then the worth of goods sold is||cannot be determined|rs. 10000|rs. 20000|rs. 5000",
  "option_a": "Rs. 5000",
  "option_b": "Rs. 10000",
  "option_c": "Rs. 20000",
  "option_d": "Cannot be determined",
  "option_e": "",
  "correct_answer": "Rs. 5000",
  "answer_letter": "A",
  "version": 1
}