{
  "question_id": 67,
  "canonical_text": "the price of sugar is raised by 40. by how much percent must a man reduce his consumption of sugar so as not to increase his expenditure||28.5714|33.33|8.34|9.9",
  "option_a": "33.33%",
  "option_b": "8.34%",
  "option_c": "28.5714%",
  "option_d": "9.09%",
  "option_e": "",
  "correct_answer": "28.5714%",
  "answer_letter": "C",
  "version": 1
}