{
  "question_id": 75,
  "canonical_text": "a girl buys 2 pigeons for rs. 2182. she sells one at a profit of 8. but she sells the other at a loss of 5 and another at a price neither gain nor loss. find the selling price of a pigeon that has been sold at a profit.|||rs. 7|rs. 70|rs. 85",
  "option_a": "Rs. 70",
  "option_b": "Rs. 85",
  "option_c": "Rs. 7",
  "option_d": "",
  "option_e": "",
  "correct_answer": "Rs. 85",
  "answer_letter": "B",
  "version": 1
}