{
  "question_id": 78,
  "canonical_text": "multi choice type question 95 if ratio of the selling price of the article and the price be 45 then the percentage of profit is||choice|multi|question|type",
  "option_a": "Multi",
  "option_b": "Choice",
  "option_c": "Type",
  "option_d": "Question",
  "option_e": "",
  "correct_answer": "Multi",
  "answer_letter": "A",
  "version": 1
}