{
  "question_id": 35,
  "canonical_text": "multi choice type question to make a profit of 20 the selling price of the good is rs. 240. the cost price of the good is||rs.120|rs.200|rs.210|rs.220",
  "option_a": "Rs.200",
  "option_b": "Rs.210",
  "option_c": "Rs.220",
  "option_d": "Rs.120",
  "option_e": "",
  "correct_answer": "Rs.200",
  "answer_letter": "A",
  "version": 1
}