{
  "question_id": 73,
  "canonical_text": "article costing rs 171 is being sold at loss. if the selling price is further reduced by 5 it will be sold at||rs 170|rs 171|rs 175|rs 179",
  "option_a": "Rs 175",
  "option_b": "Rs 179",
  "option_c": "Rs 170",
  "option_d": "Rs 171",
  "option_e": "",
  "correct_answer": "Rs 170",
  "answer_letter": "C",
  "version": 1
}