{
  "question_id": 62,
  "canonical_text": "given 2658 - 158  120 what is the value of||7|8|9|cannot be determined",
  "option_a": "Cannot be determined",
  "option_b": "8",
  "option_c": "7",
  "option_d": "9",
  "option_e": "",
  "correct_answer": "Cannot be determined",
  "answer_letter": "A",
  "version": 1
}