{
  "question_id": 26,
  "canonical_text": "a box contains 2 white balls 3 black balls and 4 red balls. in how many ways can 3 balls be drawn from the box if at least one black ball is to be included in the draw||32|48|64|96",
  "option_a": "96",
  "option_b": "32",
  "option_c": "64",
  "option_d": "48",
  "option_e": "",
  "correct_answer": "64",
  "answer_letter": "C",
  "version": 1
}