{
  "question_id": 27,
  "canonical_text": "a box contains 7 red 6 white and 4 blue balls. 3 balls are drawn. if there is one ball of each color then the number of selections is||124|148|168|186",
  "option_a": "168",
  "option_b": "148",
  "option_c": "186",
  "option_d": "124",
  "option_e": "",
  "correct_answer": "168",
  "answer_letter": "A",
  "version": 1
}