{
  "question_id": 70,
  "canonical_text": "a contains 2 red blue and 6 /3 one plate is taken up what is the it is neither red probability that nor green|||1/3|6|7",
  "option_a": "1/3",
  "option_b": "6",
  "option_c": "!",
  "option_d": "7",
  "option_e": "",
  "correct_answer": "1/3",
  "answer_letter": "A",
  "version": 1
}