{
  "question_id": 72,
  "canonical_text": "multi choice type question rs 480 shopkeper selling article atrs. 800 by an a a price should he sell 2 makes profit of 25. at what article to make a loss of 25|||rs. 480|rs. 500|rs. 520",
  "option_a": "Rs. 480",
  "option_b": "Rs. 520",
  "option_c": "Rs. 500",
  "option_d": "",
  "option_e": "",
  "correct_answer": "Rs. 520",
  "answer_letter": "B",
  "version": 1
}