{
  "question_id": 23,
  "canonical_text": "the current birth rate per thousand is 30 whereas the corresponding death rate is 10 per thousand. find the net growth rate in terms of population increase in percent.||1.5|2|2.5|3",
  "option_a": "1.5 %",
  "option_b": "2.5 %",
  "option_c": "2 %",
  "option_d": "3 %",
  "option_e": "",
  "correct_answer": "2 %",
  "answer_letter": "C",
  "version": 1
}